[
  {
    "regula": "RD-01",
    "id": "RD-01-W1",
    "wejscie": {
      "W [cm]": 50,
      "P [o./10 cm]": 22
    },
    "oczekiwane": {
      "N [o.]": 110
    },
    "tolerancja": 0.001,
    "rodzaj": "typowy",
    "pochodzenie": "rachunek: 50 × 22 / 10",
    "miejsce": "docs/brd/reguly.md:22"
  },
  {
    "regula": "RD-01",
    "id": "RD-01-W2",
    "wejscie": {
      "W [cm]": 0,
      "P [o./10 cm]": 22
    },
    "oczekiwane": {
      "N [o.]": "błąd danych"
    },
    "tolerancja": null,
    "rodzaj": "granica",
    "pochodzenie": "rachunek: W = 0 poza W > 0",
    "miejsce": "docs/brd/reguly.md:23"
  },
  {
    "regula": "RD-01",
    "id": "RD-01-W3",
    "wejscie": {
      "W [cm]": -1,
      "P [o./10 cm]": 22
    },
    "oczekiwane": {
      "N [o.]": "błąd danych"
    },
    "tolerancja": null,
    "rodzaj": "poniżej",
    "pochodzenie": "rachunek",
    "miejsce": "docs/brd/reguly.md:24"
  },
  {
    "regula": "RD-01",
    "id": "RD-01-W4",
    "wejscie": {
      "W [cm]": 0.1,
      "P [o./10 cm]": 22
    },
    "oczekiwane": {
      "N [o.]": 0.22
    },
    "tolerancja": 0.001,
    "rodzaj": "powyżej",
    "pochodzenie": "rachunek: 0,1 × 22 / 10",
    "miejsce": "docs/brd/reguly.md:25"
  },
  {
    "regula": "RD-01",
    "id": "RD-01-W5",
    "wejscie": {
      "W [cm]": 50,
      "P [o./10 cm]": "brak"
    },
    "oczekiwane": {
      "N [o.]": "błąd danych"
    },
    "tolerancja": null,
    "rodzaj": "błąd",
    "pochodzenie": "rachunek: brak próbki",
    "miejsce": "docs/brd/reguly.md:26"
  },
  {
    "regula": "RD-02",
    "id": "RD-02-W1",
    "wejscie": {
      "N [o.]": 100,
      "P_w [o./10 cm]": 20,
      "P_u [o./10 cm]": 22
    },
    "oczekiwane": {
      "N' [o.]": 110
    },
    "tolerancja": 0.001,
    "rodzaj": "typowy",
    "pochodzenie": "rachunek: 100 × 22 / 20",
    "miejsce": "docs/brd/reguly.md:38"
  },
  {
    "regula": "RD-02",
    "id": "RD-02-W2",
    "wejscie": {
      "N [o.]": 100,
      "P_w [o./10 cm]": 20,
      "P_u [o./10 cm]": 18
    },
    "oczekiwane": {
      "N' [o.]": 90
    },
    "tolerancja": 0.001,
    "rodzaj": "typowy",
    "pochodzenie": "rachunek",
    "miejsce": "docs/brd/reguly.md:39"
  },
  {
    "regula": "RD-02",
    "id": "RD-02-W3",
    "wejscie": {
      "N [o.]": 100,
      "P_w [o./10 cm]": 20,
      "P_u [o./10 cm]": 0
    },
    "oczekiwane": {
      "N' [o.]": "błąd danych"
    },
    "tolerancja": null,
    "rodzaj": "granica",
    "pochodzenie": "rachunek: P_u = 0 poza P_u > 0",
    "miejsce": "docs/brd/reguly.md:40"
  },
  {
    "regula": "RD-02",
    "id": "RD-02-W4",
    "wejscie": {
      "N [o.]": 100,
      "P_w [o./10 cm]": 20,
      "P_u [o./10 cm]": -2
    },
    "oczekiwane": {
      "N' [o.]": "błąd danych"
    },
    "tolerancja": null,
    "rodzaj": "poniżej",
    "pochodzenie": "rachunek",
    "miejsce": "docs/brd/reguly.md:41"
  },
  {
    "regula": "RD-02",
    "id": "RD-02-W5",
    "wejscie": {
      "N [o.]": 100,
      "P_w [o./10 cm]": 20,
      "P_u [o./10 cm]": 0.1
    },
    "oczekiwane": {
      "N' [o.]": 0.5
    },
    "tolerancja": 0.001,
    "rodzaj": "powyżej",
    "pochodzenie": "rachunek: 100 × 0,1 / 20",
    "miejsce": "docs/brd/reguly.md:42"
  },
  {
    "regula": "RD-02",
    "id": "RD-02-W6",
    "wejscie": {
      "N [o.]": 100,
      "P_w [o./10 cm]": 0,
      "P_u [o./10 cm]": 22
    },
    "oczekiwane": {
      "N' [o.]": "błąd danych"
    },
    "tolerancja": null,
    "rodzaj": "błąd",
    "pochodzenie": "rachunek: dzielenie przez zero",
    "miejsce": "docs/brd/reguly.md:43"
  },
  {
    "regula": "RD-03",
    "id": "RD-03-W1",
    "wejscie": {
      "Przelicznik [-]": "yd→m",
      "Wartość [jedn. wejścia]": 437
    },
    "oczekiwane": {
      "wynik [jedn. wyjścia]": 399.5928
    },
    "tolerancja": 0.0001,
    "rodzaj": "typowy",
    "pochodzenie": "S-27: 437 × 0,9144",
    "miejsce": "docs/brd/reguly.md:54"
  },
  {
    "regula": "RD-03",
    "id": "RD-03-W2",
    "wejscie": {
      "Przelicznik [-]": "in→cm",
      "Wartość [jedn. wejścia]": 4
    },
    "oczekiwane": {
      "wynik [jedn. wyjścia]": 10.16
    },
    "tolerancja": 0.0001,
    "rodzaj": "typowy",
    "pochodzenie": "S-27: 4 × 2,54",
    "miejsce": "docs/brd/reguly.md:55"
  },
  {
    "regula": "RD-03",
    "id": "RD-03-W3",
    "wejscie": {
      "Przelicznik [-]": "oz→g",
      "Wartość [jedn. wejścia]": 3.5
    },
    "oczekiwane": {
      "wynik [jedn. wyjścia]": 99.22332
    },
    "tolerancja": 0.0001,
    "rodzaj": "typowy",
    "pochodzenie": "S-27: 3,5 × 28,34952",
    "miejsce": "docs/brd/reguly.md:56"
  },
  {
    "regula": "RD-03",
    "id": "RD-03-W4",
    "wejscie": {
      "Przelicznik [-]": "yd→m",
      "Wartość [jedn. wejścia]": 0
    },
    "oczekiwane": {
      "wynik [jedn. wyjścia]": 0
    },
    "tolerancja": 0,
    "rodzaj": "granica",
    "pochodzenie": "rachunek",
    "miejsce": "docs/brd/reguly.md:57"
  },
  {
    "regula": "RD-03",
    "id": "RD-03-W5",
    "wejscie": {
      "Przelicznik [-]": "in→cm",
      "Wartość [jedn. wejścia]": -1
    },
    "oczekiwane": {
      "wynik [jedn. wyjścia]": "błąd danych"
    },
    "tolerancja": null,
    "rodzaj": "poniżej",
    "pochodzenie": "rachunek",
    "miejsce": "docs/brd/reguly.md:58"
  },
  {
    "regula": "RD-03",
    "id": "RD-03-W6",
    "wejscie": {
      "Przelicznik [-]": "in→cm",
      "Wartość [jedn. wejścia]": 0.01
    },
    "oczekiwane": {
      "wynik [jedn. wyjścia]": 0.0254
    },
    "tolerancja": 0.0001,
    "rodzaj": "powyżej",
    "pochodzenie": "S-27",
    "miejsce": "docs/brd/reguly.md:59"
  },
  {
    "regula": "RD-03",
    "id": "RD-03-W7",
    "wejscie": {
      "Przelicznik [-]": "oz→g",
      "Wartość [jedn. wejścia]": "brak"
    },
    "oczekiwane": {
      "wynik [jedn. wyjścia]": "błąd danych"
    },
    "tolerancja": null,
    "rodzaj": "błąd",
    "pochodzenie": "rachunek",
    "miejsce": "docs/brd/reguly.md:60"
  },
  {
    "regula": "RD-04",
    "id": "RD-04-W1",
    "wejscie": {
      "P4 [o./4 in]": 20
    },
    "oczekiwane": {
      "P10 [o./10 cm]": 19.685
    },
    "tolerancja": 0.001,
    "rodzaj": "typowy",
    "pochodzenie": "rachunek: 20 × 10 / 10,16",
    "miejsce": "docs/brd/reguly.md:72"
  },
  {
    "regula": "RD-04",
    "id": "RD-04-W2",
    "wejscie": {
      "P4 [o./4 in]": 22
    },
    "oczekiwane": {
      "P10 [o./10 cm]": 21.654
    },
    "tolerancja": 0.001,
    "rodzaj": "typowy",
    "pochodzenie": "rachunek",
    "miejsce": "docs/brd/reguly.md:73"
  },
  {
    "regula": "RD-04",
    "id": "RD-04-W3",
    "wejscie": {
      "P4 [o./4 in]": 0
    },
    "oczekiwane": {
      "P10 [o./10 cm]": "błąd danych"
    },
    "tolerancja": null,
    "rodzaj": "granica",
    "pochodzenie": "rachunek",
    "miejsce": "docs/brd/reguly.md:74"
  },
  {
    "regula": "RD-04",
    "id": "RD-04-W4",
    "wejscie": {
      "P4 [o./4 in]": -5
    },
    "oczekiwane": {
      "P10 [o./10 cm]": "błąd danych"
    },
    "tolerancja": null,
    "rodzaj": "poniżej",
    "pochodzenie": "rachunek",
    "miejsce": "docs/brd/reguly.md:75"
  },
  {
    "regula": "RD-04",
    "id": "RD-04-W5",
    "wejscie": {
      "P4 [o./4 in]": 0.1
    },
    "oczekiwane": {
      "P10 [o./10 cm]": 0.098
    },
    "tolerancja": 0.001,
    "rodzaj": "powyżej",
    "pochodzenie": "rachunek",
    "miejsce": "docs/brd/reguly.md:76"
  },
  {
    "regula": "RD-04",
    "id": "RD-04-W6",
    "wejscie": {
      "P4 [o./4 in]": "brak"
    },
    "oczekiwane": {
      "P10 [o./10 cm]": "błąd danych"
    },
    "tolerancja": null,
    "rodzaj": "błąd",
    "pochodzenie": "rachunek",
    "miejsce": "docs/brd/reguly.md:77"
  },
  {
    "regula": "RD-05",
    "id": "RD-05-W1",
    "wejscie": {
      "N [o.]": 100,
      "k [o.]": 8
    },
    "oczekiwane": {
      "q [o.]": 12,
      "r [-]": 4
    },
    "tolerancja": 0,
    "rodzaj": "typowy",
    "pochodzenie": "rachunek: 4×13 + 4×12 = 100",
    "miejsce": "docs/brd/reguly.md:88"
  },
  {
    "regula": "RD-05",
    "id": "RD-05-W2",
    "wejscie": {
      "N [o.]": 96,
      "k [o.]": 12
    },
    "oczekiwane": {
      "q [o.]": 8,
      "r [-]": 0
    },
    "tolerancja": 0,
    "rodzaj": "typowy",
    "pochodzenie": "rachunek",
    "miejsce": "docs/brd/reguly.md:89"
  },
  {
    "regula": "RD-05",
    "id": "RD-05-W3",
    "wejscie": {
      "N [o.]": 100,
      "k [o.]": 100
    },
    "oczekiwane": {
      "q [o.]": 1,
      "r [-]": 0
    },
    "tolerancja": 0,
    "rodzaj": "granica",
    "pochodzenie": "rachunek: k = N",
    "miejsce": "docs/brd/reguly.md:90"
  },
  {
    "regula": "RD-05",
    "id": "RD-05-W4",
    "wejscie": {
      "N [o.]": 100,
      "k [o.]": 101
    },
    "oczekiwane": {
      "q [o.]": "błąd danych",
      "r [-]": "błąd danych"
    },
    "tolerancja": null,
    "rodzaj": "powyżej",
    "pochodzenie": "rachunek: k > N",
    "miejsce": "docs/brd/reguly.md:91"
  },
  {
    "regula": "RD-05",
    "id": "RD-05-W5",
    "wejscie": {
      "N [o.]": 100,
      "k [o.]": 0
    },
    "oczekiwane": {
      "q [o.]": "błąd danych",
      "r [-]": "błąd danych"
    },
    "tolerancja": null,
    "rodzaj": "poniżej",
    "pochodzenie": "rachunek: k < 1",
    "miejsce": "docs/brd/reguly.md:92"
  },
  {
    "regula": "RD-05",
    "id": "RD-05-W6",
    "wejscie": {
      "N [o.]": "brak",
      "k [o.]": 8
    },
    "oczekiwane": {
      "q [o.]": "błąd danych",
      "r [-]": "błąd danych"
    },
    "tolerancja": null,
    "rodzaj": "błąd",
    "pochodzenie": "rachunek",
    "miejsce": "docs/brd/reguly.md:93"
  },
  {
    "regula": "RD-06",
    "id": "RD-06-W1",
    "wejscie": {
      "N [o.]": 100,
      "k [o.]": 8
    },
    "oczekiwane": {
      "q [o.]": 12,
      "r [-]": 4
    },
    "tolerancja": 0,
    "rodzaj": "typowy",
    "pochodzenie": "rachunek: wynik 92 o.",
    "miejsce": "docs/brd/reguly.md:104"
  },
  {
    "regula": "RD-06",
    "id": "RD-06-W2",
    "wejscie": {
      "N [o.]": 100,
      "k [o.]": 50
    },
    "oczekiwane": {